{"activation":{"contract_version":1,"source_event_type":"goal/change"},"eval_binding":{"eval_pack_id":"open-coding-goal-v1","expectations":{"holdout":"task-defined","non_trigger":"activation-forbidden","trigger":"activation-required"},"holdout_policy":"first-model-exposure-only","registry_ref":"registry/registry.json","registry_sha256":"2b448ce6954cff1d0d1a134164ab313fd37a10886bf245529a7a72d54055d7f5"},"harness_id":"dsh-goal-stack","harness_version":"0.2.0-rc.4","intervention":{"allowed_config_paths":["goal.disabled","goal-round-driver.disabled","command-goal.disabled","tool-goal.disabled"],"rows":["goal","goal-round-driver","command-goal","tool-goal"]},"schema_version":1}
